{
  "$schema": "http://json-schema.org/draft-07/schema#",
  "$id": "https://odd.regionallyfamous.com/catalog/v1/registry.schema.json",
  "title": "ODD Catalog Registry",
  "type": "object",
  "required": [
    "version",
    "bundles"
  ],
  "properties": {
    "$schema": {
      "type": "string"
    },
    "version": {
      "type": "integer",
      "const": 1
    },
    "generated_at": {
      "type": "string"
    },
    "starter_pack": {
      "type": "object",
      "properties": {
        "scenes": {
          "type": "array",
          "items": {
            "type": "string"
          }
        },
        "iconSets": {
          "type": "array",
          "items": {
            "type": "string"
          }
        },
        "cursorSets": {
          "type": "array",
          "items": {
            "type": "string"
          }
        },
        "widgets": {
          "type": "array",
          "items": {
            "type": "string"
          }
        },
        "apps": {
          "type": "array",
          "items": {
            "type": "string"
          }
        }
      }
    },
    "bundles": {
      "type": "array",
      "items": {
        "type": "object",
        "required": [
          "type",
          "slug",
          "name",
          "version",
          "icon_url",
          "download_url",
          "sha256",
          "size",
          "card_url"
        ],
        "properties": {
          "type": {
            "type": "string",
            "enum": [
              "scene",
              "icon-set",
              "cursor-set",
              "widget",
              "app"
            ]
          },
          "slug": {
            "type": "string",
            "pattern": "^[a-z0-9][a-z0-9-]*$"
          },
          "name": {
            "type": "string"
          },
          "version": {
            "type": "string",
            "pattern": "^[0-9]+\\.[0-9]+\\.[0-9]+(?:-[0-9A-Za-z.-]+)?(?:\\+[0-9A-Za-z.-]+)?$"
          },
          "author": {
            "type": "string"
          },
          "description": {
            "type": "string"
          },
          "franchise": {
            "type": "string"
          },
          "tags": {
            "type": "array",
            "items": {
              "type": "string"
            }
          },
          "icon_url": {
            "type": "string"
          },
          "card_url": {
            "type": "string"
          },
          "download_url": {
            "type": "string"
          },
          "sha256": {
            "type": "string",
            "pattern": "^[0-9a-f]{64}$"
          },
          "size": {
            "type": "integer",
            "minimum": 1
          },
          "accent": {
            "type": "string"
          },
          "requires": {
            "type": "object",
            "additionalProperties": false,
            "properties": {
              "odd": {
                "type": "string",
                "pattern": "^[0-9]+\\.[0-9]+\\.[0-9]+(?:-[0-9A-Za-z.-]+)?(?:\\+[0-9A-Za-z.-]+)?$"
              },
              "desktopMode": {
                "type": "string",
                "pattern": "^[0-9]+\\.[0-9]+\\.[0-9]+(?:-[0-9A-Za-z.-]+)?(?:\\+[0-9A-Za-z.-]+)?$"
              },
              "api": {
                "type": "string",
                "pattern": "^[0-9]+\\.[0-9]+\\.[0-9]+(?:-[0-9A-Za-z.-]+)?(?:\\+[0-9A-Za-z.-]+)?$"
              }
            }
          }
        }
      }
    }
  }
}
