{
  "$schema": "https://odd.regionallyfamous.com/catalog/v1/registry.schema.json",
  "version": 1,
  "generated_at": "",
  "starter_pack": {
    "scenes": [
      "oddling-desktop"
    ],
    "iconSets": [
      "odd-default-icons"
    ],
    "cursorSets": [
      "odd-default-cursors"
    ],
    "widgets": [],
    "apps": []
  },
  "bundles": [
    {
      "type": "scene",
      "slug": "abyssal-aquarium",
      "name": "Abyssal Aquarium",
      "version": "1.0.0",
      "author": "Regionally Famous",
      "description": "Abyssal Aquarium \u2014 a painted ODD wallpaper scene.",
      "category": "ODD Originals",
      "tags": [
        "gpt-image-2",
        "aquarium",
        "deep-sea",
        "bioluminescent",
        "parallax"
      ],
      "heroSafe": true,
      "icon_url": "https://odd.regionallyfamous.com/catalog/v1/icons/scene-abyssal-aquarium.webp",
      "card_url": "https://odd.regionallyfamous.com/catalog/v1/cards/scene-abyssal-aquarium.webp",
      "download_url": "https://odd.regionallyfamous.com/catalog/v1/bundles/scene-abyssal-aquarium.wp",
      "sha256": "8fb129ea28231a6e3248a700a07453e9541742f7d2343add73a80e0f212c6265",
      "size": 249181
    },
    {
      "type": "scene",
      "slug": "aurora",
      "name": "Aurora",
      "version": "1.0.0",
      "author": "Regionally Famous",
      "description": "Aurora \u2014 a painted ODD wallpaper scene.",
      "category": "Atmosphere",
      "tags": [
        "sky",
        "stars",
        "aurora",
        "cold",
        "blue"
      ],
      "heroSafe": true,
      "icon_url": "https://odd.regionallyfamous.com/catalog/v1/icons/scene-aurora.webp",
      "card_url": "https://odd.regionallyfamous.com/catalog/v1/cards/scene-aurora.webp",
      "download_url": "https://odd.regionallyfamous.com/catalog/v1/bundles/scene-aurora.wp",
      "sha256": "598c75b3d2fe9bc30adf94050765d749265e2825efd94777bba55a2afa877280",
      "size": 160815
    },
    {
      "type": "scene",
      "slug": "balcony-noon",
      "name": "Balcony Noon",
      "version": "1.0.0",
      "author": "Regionally Famous",
      "description": "Balcony Noon \u2014 a painted ODD wallpaper scene.",
      "category": "ODD Originals",
      "tags": [
        "gpt-image-2",
        "city",
        "laundry",
        "anime",
        "summer"
      ],
      "heroSafe": true,
      "icon_url": "https://odd.regionallyfamous.com/catalog/v1/icons/scene-balcony-noon.webp",
      "card_url": "https://odd.regionallyfamous.com/catalog/v1/cards/scene-balcony-noon.webp",
      "download_url": "https://odd.regionallyfamous.com/catalog/v1/bundles/scene-balcony-noon.wp",
      "sha256": "a030e17e9ea409e754e747551d9b8a017febad0e3b8432a3fe3ba12dd59023bd",
      "size": 245666
    },
    {
      "type": "scene",
      "slug": "beach-umbrellas",
      "name": "Beach Umbrellas",
      "version": "1.0.0",
      "author": "Regionally Famous",
      "description": "Beach Umbrellas \u2014 a painted ODD wallpaper scene.",
      "category": "ODD Originals",
      "tags": [
        "gpt-image-2",
        "beach",
        "aerial",
        "summer",
        "pattern"
      ],
      "heroSafe": true,
      "icon_url": "https://odd.regionallyfamous.com/catalog/v1/icons/scene-beach-umbrellas.webp",
      "card_url": "https://odd.regionallyfamous.com/catalog/v1/cards/scene-beach-umbrellas.webp",
      "download_url": "https://odd.regionallyfamous.com/catalog/v1/bundles/scene-beach-umbrellas.wp",
      "sha256": "4689a1a2f851a3082c8013f52646bf9d2a08e6052d0da4b875742514bbeb8f7a",
      "size": 311597
    },
    {
      "type": "scene",
      "slug": "big-sky",
      "name": "Big Sky",
      "version": "1.0.0",
      "author": "Regionally Famous",
      "description": "Big Sky \u2014 a painted ODD wallpaper scene.",
      "category": "ODD Originals",
      "tags": [
        "gpt-image-2",
        "clouds",
        "prairie",
        "landscape",
        "parallax"
      ],
      "heroSafe": true,
      "icon_url": "https://odd.regionallyfamous.com/catalog/v1/icons/scene-big-sky.webp",
      "card_url": "https://odd.regionallyfamous.com/catalog/v1/cards/scene-big-sky.webp",
      "download_url": "https://odd.regionallyfamous.com/catalog/v1/bundles/scene-big-sky.wp",
      "sha256": "d3e4c09f182cb1228769d351cbfc53f6cf1e148bc60a5717d90d623ab0db3f1f",
      "size": 202564
    },
    {
      "type": "scene",
      "slug": "circuit-garden",
      "name": "Circuit Garden",
      "version": "1.0.0",
      "author": "Regionally Famous",
      "description": "Circuit Garden \u2014 a painted ODD wallpaper scene.",
      "category": "ODD Originals",
      "tags": [
        "gpt-image-2",
        "circuit",
        "garden",
        "fireflies",
        "seasonal"
      ],
      "heroSafe": true,
      "icon_url": "https://odd.regionallyfamous.com/catalog/v1/icons/scene-circuit-garden.webp",
      "card_url": "https://odd.regionallyfamous.com/catalog/v1/cards/scene-circuit-garden.webp",
      "download_url": "https://odd.regionallyfamous.com/catalog/v1/bundles/scene-circuit-garden.wp",
      "sha256": "2db11368b6b0079ac524c23a72ce7a69ebb22ddb6563d16eee92c51f7433291c",
      "size": 459735
    },
    {
      "type": "scene",
      "slug": "cloud-city",
      "name": "Cloud City",
      "version": "1.0.0",
      "author": "Regionally Famous",
      "description": "Cloud City \u2014 a painted ODD wallpaper scene.",
      "category": "ODD Originals",
      "tags": [
        "gpt-image-2",
        "sky",
        "airships",
        "sunrise",
        "parallax"
      ],
      "heroSafe": true,
      "icon_url": "https://odd.regionallyfamous.com/catalog/v1/icons/scene-cloud-city.webp",
      "card_url": "https://odd.regionallyfamous.com/catalog/v1/cards/scene-cloud-city.webp",
      "download_url": "https://odd.regionallyfamous.com/catalog/v1/bundles/scene-cloud-city.wp",
      "sha256": "c66aab95916c44a47c94340289079aa42d712f3cc9a9b6290a146958444a5639",
      "size": 194853
    },
    {
      "type": "scene",
      "slug": "flux",
      "name": "Flux",
      "version": "1.0.0",
      "author": "Regionally Famous",
      "description": "Flux \u2014 a painted ODD wallpaper scene.",
      "category": "Generative",
      "tags": [
        "abstract",
        "particles",
        "flow",
        "ink",
        "dark"
      ],
      "heroSafe": true,
      "icon_url": "https://odd.regionallyfamous.com/catalog/v1/icons/scene-flux.webp",
      "card_url": "https://odd.regionallyfamous.com/catalog/v1/cards/scene-flux.webp",
      "download_url": "https://odd.regionallyfamous.com/catalog/v1/bundles/scene-flux.wp",
      "sha256": "2f8454f0a5601b47eb49817f2ed3effb84030d454fabbfb47b67c93602a71f22",
      "size": 240253
    },
    {
      "type": "scene",
      "slug": "iris-observatory",
      "name": "Iris Observatory",
      "version": "1.0.0",
      "author": "Regionally Famous",
      "description": "Iris Observatory \u2014 a painted ODD wallpaper scene.",
      "category": "ODD Originals",
      "tags": [
        "gpt-image-2",
        "observatory",
        "iris",
        "night",
        "subtle"
      ],
      "heroSafe": true,
      "icon_url": "https://odd.regionallyfamous.com/catalog/v1/icons/scene-iris-observatory.webp",
      "card_url": "https://odd.regionallyfamous.com/catalog/v1/cards/scene-iris-observatory.webp",
      "download_url": "https://odd.regionallyfamous.com/catalog/v1/bundles/scene-iris-observatory.wp",
      "sha256": "16b007114402043958ff82ce27365ec4d0a90ba85bfbf5999a2a76beea6b868c",
      "size": 269728
    },
    {
      "type": "scene",
      "slug": "mercado",
      "name": "Mercado",
      "version": "1.0.0",
      "author": "Regionally Famous",
      "description": "Mercado \u2014 a painted ODD wallpaper scene.",
      "category": "ODD Originals",
      "tags": [
        "gpt-image-2",
        "market",
        "papel-picado",
        "marigold",
        "festive"
      ],
      "heroSafe": true,
      "icon_url": "https://odd.regionallyfamous.com/catalog/v1/icons/scene-mercado.webp",
      "card_url": "https://odd.regionallyfamous.com/catalog/v1/cards/scene-mercado.webp",
      "download_url": "https://odd.regionallyfamous.com/catalog/v1/bundles/scene-mercado.wp",
      "sha256": "bd08b586969799feb42934ffb5453b0f6caf2a78f7b209e67084f86365714212",
      "size": 338734
    },
    {
      "type": "scene",
      "slug": "oddling-desktop",
      "name": "Oddling Desktop",
      "version": "1.0.0",
      "author": "Regionally Famous",
      "description": "A living CRT terrarium and specimen cabinet. Tiny desktop oddlings drift over glass drawers while curious eyes blink from the edges.",
      "category": "ODD Defaults",
      "tags": [
        "weird",
        "creatures",
        "terrarium",
        "glass",
        "specimens",
        "crt",
        "default"
      ],
      "heroSafe": true,
      "icon_url": "https://odd.regionallyfamous.com/catalog/v1/icons/scene-oddling-desktop.webp",
      "card_url": "https://odd.regionallyfamous.com/catalog/v1/cards/scene-oddling-desktop.webp",
      "download_url": "https://odd.regionallyfamous.com/catalog/v1/bundles/scene-oddling-desktop.wp",
      "sha256": "5a21e5581c22a4822058769534a9248d0d17760560430db50174b6a04b88fdb5",
      "size": 163565
    },
    {
      "type": "scene",
      "slug": "origami",
      "name": "Origami",
      "version": "1.0.0",
      "author": "Regionally Famous",
      "description": "Origami \u2014 a painted ODD wallpaper scene.",
      "category": "Paper",
      "tags": [
        "soft",
        "pastel",
        "paper",
        "calm",
        "warm"
      ],
      "heroSafe": true,
      "icon_url": "https://odd.regionallyfamous.com/catalog/v1/icons/scene-origami.webp",
      "card_url": "https://odd.regionallyfamous.com/catalog/v1/cards/scene-origami.webp",
      "download_url": "https://odd.regionallyfamous.com/catalog/v1/bundles/scene-origami.wp",